{"$schema":"https://json-schema.org/draft/2020-12/schema","$defs":{"sha":{"type":"string","pattern":"^[0-9a-f]{64}$"},"date":{"type":"string","pattern":"^[0-9]{4}-[0-9]{2}-[0-9]{2}$"}},"type":"object","additionalProperties":false,"properties":{"schema_version":{"const":"sunday_weekly_input_set_v0.1"},"symbol":{"type":"string","pattern":"^[0-9]{6}$"},"week_start":{"$ref":"#/$defs/date"},"week_end":{"$ref":"#/$defs/date"},"calendar_identities":{"type":"array","minItems":1,"items":{"type":"object","additionalProperties":false,"properties":{"calendar_year":{"type":"integer","minimum":1900,"maximum":9999},"raw_sha256":{"$ref":"#/$defs/sha"}},"required":["calendar_year","raw_sha256"]}},"semantic_config_sha256":{"$ref":"#/$defs/sha"},"daily_inputs":{"type":"array","minItems":1,"items":{"type":"object","additionalProperties":false,"properties":{"trade_date":{"$ref":"#/$defs/date"},"facts_sha256":{"$ref":"#/$defs/sha"},"daily_review_sha256":{"$ref":"#/$defs/sha"},"phase_b_manifest_sha256":{"$ref":"#/$defs/sha"},"phase_c_manifest_sha256":{"$ref":"#/$defs/sha"}},"required":["trade_date","facts_sha256","daily_review_sha256","phase_b_manifest_sha256","phase_c_manifest_sha256"]}}},"required":["schema_version","symbol","week_start","week_end","calendar_identities","semantic_config_sha256","daily_inputs"]}
