{"calendar_identities":[{"calendar_year":2026,"raw_sha256":"fd693d1e62b46408e7fbff3049e06cd368e5026279398d0c5e5344e3472add5e"}],"daily_inputs":[{"daily_review_sha256":"537ff5e5612e65a713e30afa44107cb33b2cc52eef350d306add50ba91478964","facts_sha256":"4ef128d6314383f40263b6cba137ae10a9e7fc5d3353ef109db666e6978b1460","phase_b_manifest_sha256":"853886f6632857231374d156c71ac3f6c6fc58516af7c75a62d50371b5521387","phase_c_manifest_sha256":"cd7a603504be41cee7df1670fed65a09f7fc2b16507cac19f1a0912314790122","trade_date":"2026-07-20"},{"daily_review_sha256":"6a5a829644379204efb9e528be6d408435acca1bdeade1a872c6073aaa560f7a","facts_sha256":"d5049f43f612744558c5e572938e49c60650657991c339627cade2979b3fc071","phase_b_manifest_sha256":"7773ec4e07a59ae1ee733420ead083ded48d988fa6c6a186e9811ca444477478","phase_c_manifest_sha256":"85d0ffe38d2e3e0f56837476ce1e005b2f8677350b9bf234b9146e147b35c671","trade_date":"2026-07-21"},{"daily_review_sha256":"4eed915f06d64f10108938c2935ce6e49b69cb573f28e18744c2a78f421efad4","facts_sha256":"795a4e77a84fcdebfd5f2f52b088728d86c20833c0d33318c3687298e30ab30a","phase_b_manifest_sha256":"4496ecf4f8596f6bc0fb85b961bbb8dc435ad6cedd3dbb2d392cd15731b4b34c","phase_c_manifest_sha256":"fce2bcaf88759ef5fc2d00bb793c9fdb401889c6f6e77263a94fcb244c6cf008","trade_date":"2026-07-22"},{"daily_review_sha256":"67973ddd7c635c61d29d2583a104b6a2e911de1b1494d7fd19c4889b18a07b13","facts_sha256":"c5cf1efae2bcaacd586117ce413e3f374a54912fda5d0c81a5a5f90fad3eab27","phase_b_manifest_sha256":"adf11ffabbde4d5c6afd90e8e0d11ecc924f7dcc680aca8e9c8b32e3d707bf3d","phase_c_manifest_sha256":"d4717c4805acdd4915a6ed2dbcb43af861008f7faa5bf102ebf5c4b46a337677","trade_date":"2026-07-23"},{"daily_review_sha256":"7314f1ce4a3884b2222d40ee784a993534c6a6e5c96c28237ae10879577d718f","facts_sha256":"09b30acc84ae65715859101880ba9eb4ac1c5bf14afa27770323f0e806debff7","phase_b_manifest_sha256":"1892bfcb7fd989ef122a8e9f4aa24b706f4363886d9ba281c1f5ed340ae47b78","phase_c_manifest_sha256":"ea869c02d083ddfa181d9334885ff44d09272298f0b43fb0fb25d0e0965ccaf3","trade_date":"2026-07-24"}],"schema_version":"sunday_weekly_input_set_v0.1","semantic_config_sha256":"cbe847e72349cddf3aba2a41e977c21a134f13e312a62ead3f2a36e65b5e45c3","symbol":"300274","week_end":"2026-07-24","week_start":"2026-07-20"}